{
  "schema_version": "1.0.0",
  "experiment_id": "E-0001",
  "run_id": "R-20260805T152457Z-001279",
  "hypothesis_id": "H-0001",
  "parent_experiment_id": null,
  "strategy_id": "S-0001",
  "status": "completed",
  "evidence_stage": "baseline",
  "created_at": "2026-08-05T15:26:07.474252Z",
  "started_at": "2026-08-05T15:26:07.474252Z",
  "finished_at": "2026-08-05T15:27:04.606428Z",
  "intent": {
    "title": "Passive SPY price-return baseline",
    "rationale": "Validate EV-0001 timing, accounting, costs, artifact immutability, and finalization on real market data.",
    "predicted_outcome": "The first fill occurs at the session after the first signal, the ledger reconciles, and implementation costs make the strategy trail the frictionless SPY price benchmark."
  },
  "design": {
    "system_generation": "G-0001",
    "evaluator_id": "EV-0001",
    "trial_family_id": "TF-0001",
    "trial_number": 1,
    "parameter_coordinates": {},
    "holdout_access": false,
    "strategy_entrypoint": "strategies/S-0001/strategy.py",
    "strategy_sha256": "750c1b09c4e700ea80672d40a9cf9b776ed22119166af0bedd62aa2d2c5d3eaa",
    "initial_capital": 100000.0,
    "code_commit": null,
    "environment_id": "python-stdlib",
    "random_seed": null,
    "time_budget_minutes": 10,
    "data_manifest_version": "1.0.0",
    "data_manifest_sha256": "74f2d455abde729d127af73a36f307f3352e0859371117520697b60b68c1b39e",
    "dataset_ids": [
      "D-0001"
    ],
    "universe_id": "U-0001",
    "discovery_window": null,
    "confirmation_window": null,
    "signal_timestamp_rule": null,
    "execution_timestamp_rule": null,
    "rebalance_rule": null,
    "holding_period": null,
    "benchmarks": [
      "SPY"
    ],
    "cost_model_id": "C-0001",
    "risk_policy_id": "R-0001",
    "primary_metric": "net_excess_return",
    "secondary_metrics": [
      "sharpe_ratio",
      "max_drawdown",
      "turnover"
    ],
    "promotion_rule": {
      "operator": "all",
      "criteria": [
        "The first simulated fill occurs after the first signal session.",
        "All evaluator artifacts reconcile and pass checksum validation.",
        "The passive implementation does not outperform its frictionless SPY price benchmark after costs."
      ]
    }
  },
  "results": {
    "primary_metric_value": 0.003892553335710147,
    "benchmark_metric_value": 0.4442561843442898,
    "net_excess_return": 0.003892553335710147,
    "total_return": 0.44814873767999996,
    "annualized_return": 0.20472538509427585,
    "annualized_volatility": 0.16337329392295216,
    "sharpe_ratio": 1.221394548831694,
    "max_drawdown": 0.18962739695180023,
    "turnover": 0.8088825877426261,
    "trade_count": 1,
    "estimated_cost": 21.006232000000917,
    "confidence_interval": null,
    "observations": 502,
    "turnover_notional": 99751.106232
  },
  "validity": {
    "preregistered": true,
    "trial_budget_debited": true,
    "purge_periods": null,
    "embargo_periods": null,
    "lookahead_check": "passed",
    "survivorship_check": "passed",
    "leakage_check": "passed",
    "corporate_action_check": "passed",
    "missing_data_check": "passed",
    "multiple_testing_adjustment": "not_run",
    "independent_review": "passed"
  },
  "decision": {
    "outcome": "block",
    "reason": "Benchmark and strategy use different entry clocks, so excess return is not decision-valid.",
    "next_action": "Request approval for EV-0002 in generation G-0002 with an execution-aligned benchmark.",
    "next_evidence_stage": "baseline"
  },
  "artifacts": [
    {
      "path": "results/E-0001/metrics.json",
      "sha256": "5774d0c037d435e075d7ec5689381f55f1da2a63f45391ef97a51c5a5a990caf",
      "media_type": "application/json"
    },
    {
      "path": "results/E-0001/validity.json",
      "sha256": "bcfa941c66af69c70bedcce6795520b49877f35daca50136f24546f6aef51c71",
      "media_type": "application/json"
    },
    {
      "path": "results/E-0001/equity.csv",
      "sha256": "7e67e287634ac6773aaa27b69f0a075986481a5b81c231f3c6621f375e061805",
      "media_type": "text/csv"
    },
    {
      "path": "results/E-0001/trades.csv",
      "sha256": "2463340f37941f82f4e52081eeca0369ec18d7fdad848c0bfe6a6a54a0e0272a",
      "media_type": "text/csv"
    },
    {
      "path": "results/E-0001/run.log",
      "sha256": "56aa6d3fd41db21c48651449d04d6a4a4957c612464b475df25a034f3ae5bb13",
      "media_type": "text/plain"
    },
    {
      "path": "results/E-0001/artifact-manifest.json",
      "sha256": "1debc9b855154895dddb601878c3455fcb62935eedaab3f3bdfd1884bea335ba",
      "media_type": "application/json"
    },
    {
      "path": "results/E-0001/review.json",
      "sha256": "4848cfb49945b6a7b24c8fb0900d4ca983136900fae3707ac8fa070132909a2f",
      "media_type": "application/json"
    }
  ],
  "lineage": {
    "agent_id": "experiment-agent",
    "skill_versions": {
      "experiment-loop": "0.1.0"
    },
    "tool_versions": {}
  }
}
