{
  "schema_version": "1.0.0",
  "experiment_id": "E-0001",
  "run_id": "R-20260805T152457Z-001279",
  "hypothesis_id": "H-0001",
  "parent_experiment_id": null,
  "strategy_id": "S-0001",
  "status": "preregistered",
  "evidence_stage": "baseline",
  "created_at": "2026-08-05T15:26:07.474252Z",
  "started_at": null,
  "finished_at": null,
  "intent": {
    "title": "Passive SPY price-return baseline",
    "rationale": "Validate EV-0001 timing, accounting, costs, artifact immutability, and finalization on real market data.",
    "predicted_outcome": "The first fill occurs at the session after the first signal, the ledger reconciles, and implementation costs make the strategy trail the frictionless SPY price benchmark."
  },
  "design": {
    "system_generation": "G-0001",
    "evaluator_id": "EV-0001",
    "trial_family_id": "TF-0001",
    "trial_number": 1,
    "parameter_coordinates": {},
    "holdout_access": false,
    "strategy_entrypoint": "strategies/S-0001/strategy.py",
    "strategy_sha256": "750c1b09c4e700ea80672d40a9cf9b776ed22119166af0bedd62aa2d2c5d3eaa",
    "initial_capital": 100000.0,
    "code_commit": null,
    "environment_id": "python-stdlib",
    "random_seed": null,
    "time_budget_minutes": 10,
    "data_manifest_version": "1.0.0",
    "data_manifest_sha256": "74f2d455abde729d127af73a36f307f3352e0859371117520697b60b68c1b39e",
    "dataset_ids": [
      "D-0001"
    ],
    "universe_id": "U-0001",
    "discovery_window": null,
    "confirmation_window": null,
    "signal_timestamp_rule": null,
    "execution_timestamp_rule": null,
    "rebalance_rule": null,
    "holding_period": null,
    "benchmarks": [
      "SPY"
    ],
    "cost_model_id": "C-0001",
    "risk_policy_id": "R-0001",
    "primary_metric": "net_excess_return",
    "secondary_metrics": [
      "sharpe_ratio",
      "max_drawdown",
      "turnover"
    ],
    "promotion_rule": {
      "operator": "all",
      "criteria": [
        "The first simulated fill occurs after the first signal session.",
        "All evaluator artifacts reconcile and pass checksum validation.",
        "The passive implementation does not outperform its frictionless SPY price benchmark after costs."
      ]
    }
  },
  "results": null,
  "validity": {
    "preregistered": true,
    "trial_budget_debited": true,
    "purge_periods": null,
    "embargo_periods": null,
    "lookahead_check": "not_run",
    "survivorship_check": "not_run",
    "leakage_check": "not_run",
    "corporate_action_check": "not_run",
    "missing_data_check": "not_run",
    "multiple_testing_adjustment": "not_run",
    "independent_review": "not_run"
  },
  "decision": {
    "outcome": "block",
    "reason": "Pending execution and evidence review.",
    "next_action": "Complete design fields, execute, and finalize the experiment.",
    "next_evidence_stage": "baseline"
  },
  "artifacts": [],
  "lineage": {
    "agent_id": "experiment-agent",
    "skill_versions": {
      "experiment-loop": "0.1.0"
    },
    "tool_versions": {}
  }
}
